Responsive Blocks — WordPress Gutenberg Blocks;https://ru.wordpress.org/plugins/responsive-block-editor-addons/;"Более 50 креативных блоков для создания макетов с богатым содержимым в редакторе Gutenberg.
Используйте профессиональные шаблоны и начальные блоки для создания веб-сайтов …";4 000+ активных установок;6.8.1Image Gallery Block;https://ru.wordpress.org/plugins/image-gallery-block/;Произведите впечатление на свою аудиторию красивой галереей изображений с лайтбоксами.;4 000+ активных установок;6.6.2CP Media Player — Audio Player and Video Player;https://ru.wordpress.org/plugins/audio-and-video-player/;CP Media Player — Audio and Video Player supported by major browsers, such as IE, Firefox, Opera, Safari, Chrome, and mobile devices: iPhone, iPad, An …;4 000+ активных установок;6.8.1Browser Screenshots;https://ru.wordpress.org/plugins/browser-shots/;Автоматизируйте процесс создания скриншотов веб-сайтов.;4 000+ активных установок;6.5.0Heroic Glossary — Block for building Glossaries, Dictionaries and more;https://ru.wordpress.org/plugins/heroic-glossary/;The best WordPress glossary builder plugin to create and manage your own glossary of terms.;4 000+ активных установок;6.7.2Paymattic — Secure, Simple Payment & Donation with Subscription Payments, Recurring Donations, Customer Management;https://ru.wordpress.org/plugins/wp-payment-form/;Create payment form, donate button to accept payments and donations. Manage subscription payment, recurring donation with customer/donor management.;4 000+ активных установок;6.8.1Content Slider Block;https://ru.wordpress.org/plugins/content-slider-block/;Power up your website with the Content Slider Block plugin. Easily create professional sliders using our new block editor integration!;4 000+ активных установок;6.8.1Tag Groups is the Advanced Way to Display Your Taxonomy Terms;https://ru.wordpress.org/plugins/tag-groups/;Tag Groups allows you to organize your WordPress taxonomy terms and show them in clouds, tabs, accordions, tables, lists and much more.;4 000+ активных установок;6.8.1Slider Hero with Video Background, Animation;https://ru.wordpress.org/plugins/slider-hero/;Hero Slider with Youtube Video Background & Animation Effects. Adverts, Text Carousels, Animated Header — Elementor Slider Widget & Gutenberg;3 000+ активных установок;6.7.2Gutenberg Block for WooCommerce Product Table;https://ru.wordpress.org/plugins/block-for-woo-product-table/;A WordPress editor block which implements the options found in the WooCommerce Product Table shortcode;3 000+ активных установок;6.7.2Chartify — WordPress Chart Plugin;https://ru.wordpress.org/plugins/chart-builder/;Chartify is a powerful WordPress Chart Builder Plugin that will help you to create WordPress Graphs & Charts easily and quickly.;3 000+ активных установок;6.8.1Media Slider — фотослайдер, видеослайдер, слайдер ссылок, карусельное слайд-шоу;https://ru.wordpress.org/plugins/media-slider/;Amazing & easy-to-use WordPress slider plugin. Create responsive image, video, link sliders, thumbnails, carousels & autoplay with ease!;3 000+ активных установок;6.7.2Algori Video and Image Slider;https://ru.wordpress.org/plugins/algori-image-video-slider/;Algori Video and Image Slider это плагинов блоков Gutenberg, который позволяет легко добавлять слайдеры видео и изображений на ваш сайт.;3 000+ активных установок;6.0.9Forms for Mailchimp by Optin Cat — Grow Your MailChimp List;https://ru.wordpress.org/plugins/mailchimp-wp/;Forms for Mailchimp by Optin Cat helps you grow your MailChimp list. Create popups, inline forms, sidebar widgets & more.;3 000+ активных установок;6.8.1Post Layouts for Gutenberg;https://ru.wordpress.org/plugins/post-layouts/;A beautiful post layouts block to showcase your posts in grid and list layout with multiple templates availability.;3 000+ активных установок;6.8.1Modal Popup Box — Popup Builder, Show Offers And News in Popup;https://ru.wordpress.org/plugins/modal-popup-box/;Modal popup box embed anything like image, YouTube & Vimeo videos, image gallery, slider, coupon, offers, plugin shortcodes, forms.;2 000+ активных установок;6.7.2Slider Responsive Slideshow — Image slider, Gallery slideshow;https://ru.wordpress.org/plugins/slider-responsive-slideshow/;Responsive slider plugin for your WordPres website. Carousel, Responsive Image Slider, Photo slider, Slider Gallery.;2 000+ активных установок;6.7.2Grids: Layout builder for WordPress;https://ru.wordpress.org/plugins/grids/;The most advanced page and layout builder for Gutenberg and the new Block Editor, with columns, rows and responsive controls.;2 000+ активных установок;6.4.5YITH Slider for page builders;https://ru.wordpress.org/plugins/yith-slider-for-page-builders/;"""YITH Slider for page Builders"" добавит на ваш сайт классные блочно-ориентированные слайдеры. Работает с редактором блоков Gutenberg.";2 000+ активных установок;6.4.5Email Marketing by EmailOctopus;https://ru.wordpress.org/plugins/emailoctopus/;Official plugin. Allows you to add EmailOctopus subscriber forms to your WordPress site.;2 000+ активных установок;6.8.1Elfsight Blocks;https://ru.wordpress.org/plugins/elfsight-blocks/;Custom Gutenberg Blocks to embed the Elfsight Widgets.;2 000+ активных установок;6.5.5Social Media Feed — Social Feed Gallery With API;https://ru.wordpress.org/plugins/wp-instagram-feed-awplife/;Social Media Feed for Instagram is a clean, customizable, and responsive WordPress plugin designed to showcase your Instagram feed content seamlessly.;2 000+ активных установок;6.7.2JVM Gutenberg Rich Text Icons;https://ru.wordpress.org/plugins/jvm-rich-text-icons/;Добавляйте значки Font Awesome или значки из пользовательского набора значков в поля форматированного текста в любом месте редактора блоков Gutenberg!;2 000+ активных установок;6.6.2Animated Live Wall — Photo Animation, Feed Gallery Image Change Animation;https://ru.wordpress.org/plugins/animated-live-wall/;Animated live wall gallery creates a dynamic photo wall with animated blocks from Instagram, Flickr, or uploaded media.;2 000+ активных установок;6.7.2Super Web Share — Native Social Sharing Button;https://ru.wordpress.org/plugins/super-web-share/;Super Web Share helps you easily add a native share prompt to your website, allowing you to share a page or post in less than a minute.;2 000+ активных установок;6.8.1WordPress CRM, Email & Marketing Automation for WordPress | Award Winner — Groundhogg;https://ru.wordpress.org/plugins/groundhogg/;Groundhogg is the best WordPress CRM & Marketing Automation plugin. Create flows, email campaigns, and have a CRM all within your WordPress site.;2 000+ активных установок;6.8.1ProHotspots Lite — Image Gallery Hotspots;https://ru.wordpress.org/plugins/prohotpoints-gallery/;Create custom hotspots to make your images more informative and interactive using the WordPress blocks.;50+ активных установок;5.1.19Clapback;https://ru.wordpress.org/plugins/clapback/;The👏Clapback👏Block👏puts👏an👏emoji👏between👏your👏words.;40+ активных установок;6.7.2startpage;https://ru.wordpress.org/plugins/startpage/;Создайте собственную начальную страницу для браузера в WordPress.;40+ активных установок;5.1.19Hero Banner Slider;https://ru.wordpress.org/plugins/hero-banner-slider/;WordPress Gutenberg editor plugin for Hero Banner Slider.;40+ активных установок;5.3.18Simple Shortcode Block;https://ru.wordpress.org/plugins/simple-shortcode-block/;Простой блок для динамического выполнения шорткода в новом редакторе Gutenberg.;40+ активных установок;5.3.18Contact form builder for Gutenberg — Formello;https://ru.wordpress.org/plugins/formello/;Light-weight and easy plugin create forms inside the block editor.;40+ активных установок;6.7.2Custom Accordion Block;https://ru.wordpress.org/plugins/custom-accordion-block/;This is Gutenberg compitable Custom Accordion plugin.;40+ активных установок;5.7.12WordPress HelpDesk & Support Ticket System Plugin — Octrace Support;https://ru.wordpress.org/plugins/octrace-support/;Octrace Support is a help desk & support ticket system plugin that helps manage your support requests with ease directly from your WordPress site.;30+ активных установок;6.4.5Gecko Blocks;https://ru.wordpress.org/plugins/gecko-blocks/;Provides multiple basic block types to be used in custom themes.;30+ активных установок;5.4.16WYSIWYG Calculator Block;https://ru.wordpress.org/plugins/wysiwyg-calculator-block/;This is a WYSIWYG build your own cost Calculator block. (Great for allowing customers to calculate things like tuition and program cost);30+ активных установок;5.4.16Lyrics;https://ru.wordpress.org/plugins/lyrics-block/;Добавьте лирику в записи и страницы WordPress.;30+ активных установок;5.1.19Kenzap Steps;https://ru.wordpress.org/plugins/kenzap-steps/;A beautiful and easy customizable set of Gutenberg blocks to create steps section for the new editor. Easily adjust the following parameters:;30+ активных установок;5.1.19Gosign — Promo Box Block;https://ru.wordpress.org/plugins/gosign-promo-box-block/;This plugin enables you to add Promotion Boxes with text and button with a link.;30+ активных установок;6.0.9Testimonials Block;https://ru.wordpress.org/plugins/testimonials-block/;This plugin brings a testimonials slider block to the new WordPress Gutenberg editor.;30+ активных установок;5.0.22Custom Blocks Templates;https://ru.wordpress.org/plugins/custom-blocks-templates/;Create and set Gutenberg blocks templates for posts, pages and custom post types;30+ активных установок;6.2.6DynaMaker CAD Configurator Integration;https://ru.wordpress.org/plugins/dynamaker-cad-configurator-integration/;With the DynaMaker Plugin for Wordpress you can easily display your online configurators in a Wordpress page or post, with very few clicks and short s …;30+ активных установок;6.5.5Max width container;https://ru.wordpress.org/plugins/maximum-width-container/;This plugin creates a new Gutenberg block, which allows you yo create a container with an adjustable maximun width, giving your perfect control over t …;30+ активных установок;5.2.21Gosign — Post Teaser Block;https://ru.wordpress.org/plugins/gosign-post-teaser-block/;Its a post teaser block, where you select a post from the backend and it shows its data on the Frontend.;30+ активных установок;6.0.9User Blocks;https://ru.wordpress.org/plugins/user-blocks/;User blocks for building profile and account pages.;30+ активных установок;5.2.21Kenzap Stats;https://ru.wordpress.org/plugins/kenzap-stats/;Extend your website with counters, countdowns, bars and other statistical elements. It should work out of the box though depending on the theme used y …;20+ активных установок;5.5.15Info Blocks for WooCommerce;https://ru.wordpress.org/plugins/info-blocks-for-woocommerce/;Info blocks for WooCommerce.;20+ активных установок;6.6.2WordPress Essential Blocks;https://ru.wordpress.org/plugins/wp-essential-blocks/;Powerful and Feature Rich Blocks for Gutenberg Editor.;20+ активных установок;5.0.22Guten-bubble;https://ru.wordpress.org/plugins/guten-bubble/;Displays a speech bubble like a chat conversation.;20+ активных установок;6.1.7Popup with exit intent, scroll triggered and anchor click for opt-ins, lead gen & more;https://ru.wordpress.org/plugins/popper/;A popup builder to increase Sales, Lead Generation, Conversion rates and receive good Call to Action with exit intent.;20+ активных установок;6.8.1QuestionPro Surveys;https://ru.wordpress.org/plugins/questionpro-surveys/;QuestionPro Surveys plugin lets you embed surveys into the blog content.;20+ активных установок;5.2.21Nelio Maps;https://ru.wordpress.org/plugins/nelio-maps/;Simple and beautiful Google Maps block for WordPress.;20+ активных установок;5.1.19Rad Bootstrap 3 Blocks;https://ru.wordpress.org/plugins/rad-bootstrap-3-blocks/;This plugin inserts bootstrap 3 style grid layout block and a button block to the gutenberg editor.;20+ активных установок;5.0.22Social Media Block;https://ru.wordpress.org/plugins/social-media-block/;Social media block for Gutenberg.;20+ активных установок;5.0.22Advanced Datatable – The Ultimate Data Table Plugin;https://ru.wordpress.org/plugins/advanced-datatable/;Show Data on your website with sorting, searching and pagination.;20+ активных установок;6.7.2Payment Form for PayPal Pro;https://ru.wordpress.org/plugins/payment-form-for-paypal-pro/;Payment Form for PayPal Pro for accepting credit cards directly into your website without navigating to a PayPal page.;20+ активных установок;6.8.1Booking System Calendar;https://ru.wordpress.org/plugins/kenzap-calendar/;Display calendar section for appointments reservations or bookings. Specify custom time slots. Link checkout process with WooCommerce.;20+ активных установок;5.8.10Qroko Blocks;https://ru.wordpress.org/plugins/qroko-blocks/;Custom Blocks for headless WordPress;20+ активных установок;5.7.12Posts List Block;https://ru.wordpress.org/plugins/posts-list-block/;"Adds a ""Blog Posts Listing"" block to the editor.";20+ активных установок;5.2.21Testimonial Gutenberg Block;https://ru.wordpress.org/plugins/testimonial-block/;Testimonial Gutenberg Block allows users add testimonials and display it anywhere in page/post. With more options and style support you easy to create …;20+ активных установок;5.2.21Buttons for Gutenberg;https://ru.wordpress.org/plugins/fd-buttons-gutenberg/;Additional button styles and options of Button Block for Gutenberg/Block Editor. Best for marketing page, sales funnel, landing pages and call-to-acti …;10+ активных установок;6.7.2UniCard;https://ru.wordpress.org/plugins/unicard/;UniCard — A block plugin that can be used to create a card block with featured image, title, description fields. All fields are optional.;10+ активных установок;5.3.18Taro iframe Block;https://ru.wordpress.org/plugins/taro-iframe-block/;Add iframe block for your editor. Responsive and keeping aspect ratio.;10+ активных установок;6.8.1Test Plugin 3 — Testing plugin;https://ru.wordpress.org/plugins/test-plugin-3/;Here is a short description of the plugin.  This should be no more than 150 characters.  No markup here please.;10+ активных установок;6.7.2Gecko Grid Layout;https://ru.wordpress.org/plugins/gecko-grid-layout/;A css grid layout block for gutenberg. It allows you to create masonry like content. This could be a gallery, content flowing in unique ways, or whate …;10+ активных установок;5.1.19Blockbuddy;https://ru.wordpress.org/plugins/blockbuddy/;Gutenberg Block to easily query and display content from any post type!;10+ активных установок;5.1.0Video Block with Ads;https://ru.wordpress.org/plugins/video-block-with-ads/;Video Gutenberg Block and video player on steroids and low fat.;10+ активных установок;5.1.19Average Travel Costs;https://ru.wordpress.org/plugins/average-travel-costs/;Displays average daily travel costs from Budget Your Trip.;10+ активных установок;5.6.14Pricing Tables Block;https://ru.wordpress.org/plugins/pricing-tables-block/;This plugin brings a Pricing Tables Blocks to the new WordPress Gutenberg editor.;10+ активных установок;5.1.19Melonpan Block — Code;https://ru.wordpress.org/plugins/melonpan-block-code/;Block to display code, with highlighted syntax, which can be copied to the clipboard.;10+ активных установок;5.6.14Gecko Section;https://ru.wordpress.org/plugins/gecko-section/;A full width wrapper block.;10+ активных установок;5.0.22Besan Block;https://ru.wordpress.org/plugins/besan-block/;[Deprecated!] Add a responsive and accessible data chart block to posts and pages.;10+ активных установок;6.6.2RSVPMaker for Toastmasters;https://ru.wordpress.org/plugins/rsvpmaker-for-toastmasters/;This Toastmasters-specific extension to the RSVPMaker events plugin adds role signups and member performance tracking.;10+ активных установок;6.8.1Heading Block Font Color;https://ru.wordpress.org/plugins/heading-block-font-color/;This Plugin is made for setting the Font color for heading blocks which is not available by default for Headign block in Gutenberg.;10+ активных установок;5.0.22China Video Block;https://ru.wordpress.org/plugins/china-video-block/;🇨🇳 🎬 🧱 Блок Gutenberg для показа китайской аудитории китайского видео, и видео с YouTube для всех остальных стран.;10+ активных установок;5.8.0Cart Products for WordPress;https://ru.wordpress.org/plugins/cart-products-for-woocommerce/;Extension for Woocommerce that allows you to add products quickly and easily to the cart straight from cart or checkout page.;10+ активных установок;5.1.19Power Blocks — Powerful and Feature Rich Blocks for Gutenberg;https://ru.wordpress.org/plugins/power-blocks/;Ultimate Collection of Essential Blocks for Gutenberg Editor.;10+ активных установок;5.4.16Gutenberg Slider Blocks — Candy Slider;https://ru.wordpress.org/plugins/candy-slider/;This plugin brings a gutenberg slider block to the new WordPress Gutenberg editor.;10+ активных установок;5.4.16WP Google Places Reviews;https://ru.wordpress.org/plugins/wp-google-places-reviews/;Easily add your Google Places profile reviews to your website.;10+ активных установок;5.3.0Chatterbox;https://ru.wordpress.org/plugins/chatterbox/;Create chat threads using WordPress Blocks inside app and mobile wrappers.;10+ активных установок;5.3.18Player with Playlist Block for WordPress Editor;https://ru.wordpress.org/plugins/video-playlist-lite/;Simply add single youtube videos, youtube playlists or create youtube playlists on your WordPress blog.;10+ активных установок;5.1.19Video Popup Block;https://ru.wordpress.org/plugins/video-popup-block/;This plugin brings a Video Popup Block to the new WordPress Gutenberg editor.;10+ активных установок;5.1.19Canvas Portfolio;https://ru.wordpress.org/plugins/canvas-portfolio/;Showcase your work with Canvas Portfolio the way it’s meant to be seen. Canvas Portfolio is an extension built with photographers, artists, and design …;10+ активных установок;5.4.16OtFm Countdown to New Year block;https://ru.wordpress.org/plugins/otfm-countdown-to-new-year-block/;Плагин добавляет в редактор блоков обратный отсчет до Нового года. Показывает дни, часы, минуты и секунды до нового года.;10+ активных установок;5.5.15Kenzap Features;https://ru.wordpress.org/plugins/kenzap-features/;A beautiful and easy customizable set of Gutenberg blocks to create features section for the new editor. Easily adjust the following parameters:;10+ активных установок;5.5.15Lastweets;https://ru.wordpress.org/plugins/lastweets/;Display a Twitter account latest tweets via a Gutenberg editor block.;10+ активных установок;5.0.22GutenIpsum;https://ru.wordpress.org/plugins/gutenipsum/;Generate blind text in Gutenberg.;10+ активных установок;5.2.21Woocommerce Blocks — Woolook;https://ru.wordpress.org/plugins/woolook/;Woolook is a collection of beautiful Woocommerce blocks. It is like a Woocommerce page builder. But more fun and painless.;10+ активных установок;5.2.21Random;https://ru.wordpress.org/plugins/random-block/;Create a random layout using this plugin;10+ активных установок;5.2.21Gosign — Content Navigation Block;https://ru.wordpress.org/plugins/gosign-content-nav-block/;Create A grid layout of all the subpages of a parent page.;10+ активных установок;5.8.10Recipe Blocks;https://ru.wordpress.org/plugins/recipe-blocks/;Простые в использовании блоки для публикации рецептов, которые включают в себя подробности, ингредиенты, указания и URL источника.;10+ активных установок;5.1.0Kenzap Blog;https://ru.wordpress.org/plugins/kenzap-blog/;A beautiful and easy customizable set of Gutenberg blocks to list blog posts on your website. Easily adjust the following parameters:;10+ активных установок;5.5.15Open Orphanage;https://ru.wordpress.org/plugins/open-orphanage/;Praise Jesus, a plugin that works with an Android app, to help orphanages with the process of sponsoring orphans, and God willing more in the future.;10+ активных установок;5.2.21Testimonial Blocks;https://ru.wordpress.org/plugins/testimonial-blocks/;Easy to use block for adding testimonials to pages.;10+ активных установок;5.2.21Info Blocks;https://ru.wordpress.org/plugins/info-blocks/;gutenberg для создания предупреждений, информации или обновления текста;10+ активных установок;5.0.22Accordion Block;https://ru.wordpress.org/plugins/accordion-block/;Accordion image block new WordPress block editor;10+ активных установок;5.0.22Kenzap Pricing;https://ru.wordpress.org/plugins/kenzap-pricing/;A beautiful and easy customizable set of Gutenberg blocks to create pricing table section for the new editor. Easily adjust the following parameters:;10+ активных установок;5.5.15Double Image for Gutenberg;https://ru.wordpress.org/plugins/double-image/;A custom block designed to insert two images side by side or stacked with optional overlay text.;10+ активных установок;5.0.22Easy Blocks — Gutenberg Blocks Collection;https://ru.wordpress.org/plugins/easy-blocks/;A collection of lightweight, highly customizable & easy to use blocks for Gutenberg Editor.;10+ активных установок;5.1.19K2 Blocks;https://ru.wordpress.org/plugins/k2-blocks/;K2 Blocks Build Gutenberg Websites With Advanced Features At Lightning Speed.;10+ активных установок;6.4.5Anything Block;https://ru.wordpress.org/plugins/anything-block/;Print any kind of data, any way you want it.;Менее 10 активных установок;6.4.5Code Editor Blocks;https://ru.wordpress.org/plugins/code-editor-blocks/;HTML Editor Blocks with Code Editor.;Менее 10 активных установок;5.0.22Ever Blocks;https://ru.wordpress.org/plugins/ever-blocks/;Ever Blocks is a professional page building blocks for the WordPress Gutenberg block editor.;Менее 10 активных установок;5.7.12Blocks Collection;https://ru.wordpress.org/plugins/blocks-collection/;Blocks Collection plugin is a collection of page building premium blocks for the new Wordpress Gutenberg block editor.;Менее 10 активных установок;6.1.7Web Recipe Clipper;https://ru.wordpress.org/plugins/web-recipe-clipper/;The plugin will add a block to gutenberg editor, you can paste a web recipe link, it will clip the content to generate the recipe in the editor.;Менее 10 активных установок;5.1.19affiliate-amazon-block(aab);https://ru.wordpress.org/plugins/affiliate-amazon-blockaab/;"Add ""Amazon"" block to your block editor. Useful to add affiliate link.";Менее 10 активных установок;5.1.19Progress Bar Block;https://ru.wordpress.org/plugins/progress-bar-block/;Gutenberg block development plugin.;Менее 10 активных установок;5.0.22Mobile blocks;https://ru.wordpress.org/plugins/mobile-blocks/;Нужна помощь с мобильным сайтом? Хотите, чтобы ваши мобильные посетители были заинтересованы? Нужно увеличить конверсию продаж вашего магазина?;Менее 10 активных установок;5.9.10