Code Snippet Beautifier;https://ru.wordpress.org/plugins/wplp-code-snippet/;This plugin is used for beautify Code Snippet on website.;Менее 10 активных установок;5.2.21Melonpan Block — Post List;https://ru.wordpress.org/plugins/melonpan-block-post-list/;Block that displays a list of selected Posts and Custom post types.;Менее 10 активных установок;5.6.14Advanced Archive Blocks;https://ru.wordpress.org/plugins/advanced-archive-blocks/;Add Archive Block support Yearly, Monthly, Daily, Weekly and Post Type.;Менее 10 активных установок;5.0.22HeBo Logo Slider Gutenberg Block;https://ru.wordpress.org/plugins/hebo-logo-slider-block/;Add a simple linkable logo slider to your website;Менее 10 активных установок;5.1.19Awesome Alert Blocks;https://ru.wordpress.org/plugins/awesome-alert-blocks/;Awesome Alert Blocks notices for the new WordPress block editor.;Менее 10 активных установок;5.0.22Payment Forms CustomBlock;https://ru.wordpress.org/plugins/payment-forms-customblock/;Gutenberg custom block with Stripe Form.;Менее 10 активных установок;5.5.15Nested Posts by CurateWP;https://ru.wordpress.org/plugins/curatewp-nested-posts/;Display a list of posts which includes descendants of the current page.;Менее 10 активных установок;5.2.21Draggable Images Block;https://ru.wordpress.org/plugins/draggable-images-block/;Add and move images in your Gutenberg block as you like.;Менее 10 активных установок;5.7.12Awesome Slider Block;https://ru.wordpress.org/plugins/awesome-slider-block/;This plugin brings a Awesome Slider Block to the new WordPress Gutenberg editor.;Менее 10 активных установок;5.1.19BlocksBuster;https://ru.wordpress.org/plugins/blocksbuster/;This plugin is a collection of blocks that will help in making WordPress sites by using Gutenberg editor. We will build more blocks in the future tha …;Менее 10 активных установок;5.0.22Blog Blocks — Gutenberg Blocks for Content Writers;https://ru.wordpress.org/plugins/blog-blocks/;Blocks for content writers to make your articles more attractive to readers with elements such as notices.;Менее 10 активных установок;5.2.21Social Gallery Block;https://ru.wordpress.org/plugins/social-gallery-block/;social Posts Display Block;Менее 10 активных установок;5.6.14gitblock — Github Block Plugin;https://ru.wordpress.org/plugins/gitblock/;Overview;Менее 10 активных установок;5.5.15Advance Block Extend;https://ru.wordpress.org/plugins/advance-block-extend/;The creative and advance blocks for the Gutenberg.;Менее 10 активных установок;5.5.15FF Block Advanced Columns;https://ru.wordpress.org/plugins/ff-block-advanced-columns/;WordPress editor block that provides support for advanced inline grid layouts by extending each column in a columns block with the option to set its w …;Менее 10 активных установок;5.2.21Builder Blocks;https://ru.wordpress.org/plugins/builder-blocks/;A library of simple, easy to use blocks for the new WordPress Gutenberg editor.;Менее 10 активных установок;5.0.22mowomo Google Reviews;https://ru.wordpress.org/plugins/mowomo-google-reviews/;mowomo Google Reviews is a plugin that allows you to display your Google company ratings on your website using a gutenberg block;Менее 10 активных установок;5.5.15Yasothon;https://ru.wordpress.org/plugins/yasothon-blocks/;Yasothon is a cool plugin for the Pages editor that have many several blocks to custom your homepage. It is easy to use you just add block and select  …;Менее 10 активных установок;5.1.19Embed Plus for YouTube Gallery, Livestream and Lazy Loading with Facades;https://ru.wordpress.org/plugins/youtube-embed-plus/;A multi-featured plugin to embed YouTube in WordPress. Embed a responsive video, YouTube channel gallery, playlist gallery, YouTube livestream.;100 000+ активных установок;6.8.1GiveWP — Платформа для пожертвований и фандрайзинга;https://ru.wordpress.org/plugins/give/;Принимайте пожертвования и начинайте сбор средств с помощью GiveWP, плагина для пожертвований WordPress с самым высоким рейтингом для онлайн пожертвований.;100 000+ активных установок;6.7.2Feeds for YouTube (плагин для видео, канала и галереи YouTube);https://ru.wordpress.org/plugins/feeds-for-youtube/;Плагин Feeds for YouTube позволяет отображать настраиваемые ленты YouTube с любого канала YouTube.;100 000+ активных установок;6.8.1Schema & Structured Data for WP & AMP;https://ru.wordpress.org/plugins/schema-and-structured-data-for-wp/;Schema & Structured Data adds Google Rich Snippets markup according to Schema.org guidelines to structure your site for SEO.;100 000+ активных установок;6.8.1LuckyWP Table of Contents;https://ru.wordpress.org/plugins/luckywp-table-of-contents/;Создаёт SEO-дружественное содержание для ваших постов/страниц. Работает автоматически или вручную (через шорткод, Gutenberg-блок или виджет).;100 000+ активных установок;6.7.2Pods — Custom Content Types and Fields;https://ru.wordpress.org/plugins/pods/;Pods — это платформа для создания, управления и развертывания настраиваемых типов контента и полей для любого проекта.;100 000+ активных установок;6.8.1EmbedPress – PDF Embed, PDF 3D FlipBook, Instagram Social Feeds, Google Docs, Vimeo, Wistia, YouTube Videos, Maps & Upload PDF Documents;https://ru.wordpress.org/plugins/embedpress/;EmbedPress lets you embed videos, pages, social feeds, embed PDF 3D flipbooks & other content on WordPress without coding & enhance storytelling.;100 000+ активных установок;6.8.1Social Значки & Sharing Buttons by WPZOOM;https://ru.wordpress.org/plugins/social-icons-widget-by-wpzoom/;Add social media icons and sharing buttons to your website! Social Значки & Sharing Buttons includes 400+ icons and customizable sharing buttons.;100 000+ активных установок;6.8.1Hustle — Email Marketing, Lead Generation, Optins, Popups;https://ru.wordpress.org/plugins/wordpress-popup/;Setup email optin forms, popups, newsletter forms & subscription forms to generate email leads with the best marketing popup builder;100 000+ активных установок;6.8.1Web Stories;https://ru.wordpress.org/plugins/web-stories/;Web Stories — это визуальные истории для вашего сайта с быстрой загрузкой и полноэкранным режимом, погружающие ваших читателей в насышенный контент ваших историй.;90 000+ активных установок;6.8.1Event Tickets and Registration;https://ru.wordpress.org/plugins/event-tickets/;Event Tickets позволяет вашим посетителям регистрироваться и покупать билеты на мероприятия на вашем сайте. Также работает с Events Calendar (календарь мероприятий).;90 000+ активных установок;6.8.1Site Reviews;https://ru.wordpress.org/plugins/site-reviews/;Site Reviews is a complete review management solution for your website that is designed to work in a similar way to Amazon, Tripadvisor, and Yelp.;70 000+ активных установок;6.8.1Superb Addons: Blocks, Patterns & Theme Designer;https://ru.wordpress.org/plugins/superb-blocks/;Create beautiful WordPress websites easily with 10+ blocks, 200+ patterns, 100+ pre-built pages, animations and Theme Designer. No coding needed!;60 000+ активных установок;6.8.1Qi Blocks;https://ru.wordpress.org/plugins/qi-blocks/;Qi Blocks is the largest collection of Gutenberg blocks developed by Qode Interactive.;60 000+ активных установок;6.8.1User Profile Builder — Beautiful User Registration Forms, User Profiles & User Role Editor;https://ru.wordpress.org/plugins/profile-builder/;Powerful user profile plugin to create front-end user registration forms, login & user profile forms. Includes user role editor & content restriction.;50 000+ активных установок;6.7.2Getwid —  Блоки Gutenberg;https://ru.wordpress.org/plugins/getwid/;40+ блоков для редактора Gutenberg, а также несколько готовых бесплатных шаблонов-блоков для редактора блоков WordPress.;50 000+ активных установок;6.8.1WP Booking Calendar;https://ru.wordpress.org/plugins/booking/;"Original ""Booking Calendar"" plugin. Easily manage full-day bookings, time-slot appointments, or events in our all-in-one, outstanding booking system.";50 000+ активных установок;6.8.1User Profile Picture;https://ru.wordpress.org/plugins/metronet-profile-picture/;Установите пользовательское изображение профиля (аватар) для пользователя с помощью стандартного инструмента загрузки мультимедиа WordPress.;50 000+ активных установок;6.6.2Ultimate Blocks — Плагин блоков WordPress;https://ru.wordpress.org/plugins/ultimate-blocks/;Create Better Content With The Block Editor. Custom Blocks for Bloggers and Content Marketers.;50 000+ активных установок;6.8.1WP Recipe Maker;https://ru.wordpress.org/plugins/wp-recipe-maker/;Простой и удобный плагин рецептов для всех. Автоматические метаданные JSON-LD метаданные для еды и рецептов улучшат ваше SEO!;50 000+ активных установок;6.8.1Calculated Fields Form;https://ru.wordpress.org/plugins/calculated-fields-form/;The CFF plugin allows you to create both simple and professional forms. Its form builder includes dynamic calculated fields and many other controls.;50 000+ активных установок;6.8.1RSS Aggregator by Feedzy – Feed to Post, Autoblogging, News & YouTube Video Feeds Aggregator;https://ru.wordpress.org/plugins/feedzy-rss-feeds/;The most powerful WordPress RSS aggregator, helping you curate content, autoblog, import RSS & display unlimited RSS feeds within a few minutes.;50 000+ активных установок;6.8.1Photo Gallery, Images, Slider in Rbs Image Gallery;https://ru.wordpress.org/plugins/robo-gallery/;Rbs Image Gallery is a powerful image gallery and photo gallery plugin with advanced features to create responsive galleries with a beautiful lightbox;40 000+ активных установок;6.8.1Kit (formerly ConvertKit) — Email Newsletter, Email Marketing, Subscribers and Landing Pages;https://ru.wordpress.org/plugins/convertkit/;Build your email subscriber lists, send email marketing newsletters, sell more products and build your membership site with Kit (formerly ConvertKit).;40 000+ активных установок;6.8.1Form Maker by 10Web — Удобный для мобильных устройств конструктор контактных форм с перетаскиванием;https://ru.wordpress.org/plugins/form-maker/;Form Maker — это удобный конструктор контактных форм, который позволяет создавать формы для любых целей, от простой формы контакта до многостраничных форм опроса.;40 000+ активных установок;6.5.5Genesis Blocks;https://ru.wordpress.org/plugins/genesis-blocks/;A collection of content blocks, sections, & full-page layouts for the block editor.;40 000+ активных установок;6.6.2Post Grid Gutenberg Blocks for News, Magazines, Blog Websites — PostX;https://ru.wordpress.org/plugins/ultimate-post/;A highly customizable plugin to create news, magazines, and any kind of blog site with post grid, post filter, post slider, and post blocks.;40 000+ активных установок;6.7.2Gallery Blocks with Lightbox. Image Gallery, (HTML5 video , YouTube, Vimeo) Video Gallery and Lightbox for native gallery;https://ru.wordpress.org/plugins/simply-gallery-block/;Два в одном. Блоки галереи Gutenberg (Masonry, Justified, Slider, Carousel, Grid) и настраиваемый лайтбокс.;40 000+ активных установок;6.8.1Слайдер от Soliloquy — адаптивный слайдер изображений для WordPress;https://ru.wordpress.org/plugins/soliloquy-lite/;Лучший плагин WordPress для слайдеров. Конструктор адаптивных слайдеров с функцией перетаскивания, с которым всего парой щелчков мышью вы сможете создавать красивые слайд-шоу.;40 000+ активных установок;6.6.2Gutentor — Gutenberg Blocks — Page Builder for Gutenberg Editor;https://ru.wordpress.org/plugins/gutentor/;Advanced yet easy, Gutenberg editor page builder blocks. Create a masterpiece, pixel perfect website using modern WordPress Gutenberg blocks.;30 000+ активных установок;6.8.1Timetable and Event Schedule by MotoPress;https://ru.wordpress.org/plugins/mp-timetable/;Умный организатор и тайм-менеджмент инструмент с чистым минималистичным дизайном для вывода расписаний предстоящих событий.;30 000+ активных установок;6.7.2ThirstyAffiliates — Affiliate Links, Link Branding, Link Tracking & Marketing Plugin;https://ru.wordpress.org/plugins/thirstyaffiliates/;🔗 Affiliate link management & cloaker tool. Easily manage, shrink and track your affiliate links in WordPress. 🔥;30 000+ активных установок;6.8.1Carousel Slider Block for Gutenberg;https://ru.wordpress.org/plugins/carousel-block/;A responsive carousel slider for the Gutenberg editor that supports adding any blocks to slides.;30 000+ активных установок;6.8.1Advanced Responsive Video Embedder for Rumble, Odysee, YouTube, Vimeo, Kick …;https://ru.wordpress.org/plugins/advanced-responsive-video-embedder/;Level up your basic video embeds! Advanced features, privacy. Use URLs, Shortcodes or Blocks to customize videos to your needs.;30 000+ активных установок;6.8.1Uncanny Toolkit for LearnDash;https://ru.wordpress.org/plugins/uncanny-learndash-toolkit/;Extend LearnDash with a variety of useful modules that make it even easier to build great learner experiences with LearnDash.;30 000+ активных установок;6.8.1Portfolio Gallery — Плагин галереи изображений;https://ru.wordpress.org/plugins/portfolio-filter-gallery/;Portfolio gallery имеет отдельную страницу категорий и удобный интерфейс. Витрина портфолио, изображения, видео, галерея.;30 000+ активных установок;6.8.1Gutenberg Blocks — PublishPress Blocks Controls, Visibility, Reusable Blocks;https://ru.wordpress.org/plugins/advanced-gutenberg/;PublishPress Blocks include accordions, tables, tabs, and more. Plus it has block controls for visibility, devices, user roles.;30 000+ активных установок;6.8.1Quiz Maker;https://ru.wordpress.org/plugins/quiz-maker/;Плагин QUIZ MAKER позволяет создать и проводить неограниченное количество викторин, экзаменов и тестов.;30 000+ активных установок;6.8.1Visualizer: Tables and Charts Manager for WordPress;https://ru.wordpress.org/plugins/visualizer/;A simple yet powerful WordPress chart plugin to effortlessly create and embed responsive charts & tables into your site, supporting multiple data  …;30 000+ активных установок;6.8.1Constant Contact Forms;https://ru.wordpress.org/plugins/constant-contact-forms/;Официальный плагин Constant Contact добавляет на ваш сайт WordPress контактную форму для быстрого сбора информации от посетителей.;20 000+ активных установок;6.8.1Happyforms — Form Builder for WordPress: Drag & Drop Contact Forms, Surveys, Payments & Multipurpose Forms;https://ru.wordpress.org/plugins/happyforms/;Best WordPress contact form, newsletter form and payment form builder without the sucky stuff — lost emails, pesky spam, leaky privacy and outsourced  …;20 000+ активных установок;6.8.1Snow Monkey Editor;https://ru.wordpress.org/plugins/snow-monkey-editor/;The Snow Monkey Editor is a plugin that extends the block editor.;20 000+ активных установок;6.8.1Cool Timeline (Horizontal & Vertical Timeline);https://ru.wordpress.org/plugins/cool-timeline/;Showcase your story or company history, events, and roadmap in a precise and elegant way using the powerful Cool Timeline plugin.;20 000+ активных установок;6.8.1Accept Stripe Payments;https://ru.wordpress.org/plugins/stripe-payments/;Easily accept payments on your WordPress site via Stripe payment gateway.;20 000+ активных установок;6.8.1Toolkit for Block Theme (Starter Templates, Portfolio, Gutenberg Blocks, Patterns) – Twentig;https://ru.wordpress.org/plugins/twentig/;Create your website with starter templates, portfolio features, enhanced Gutenberg blocks & patterns. Boost Twenty Twenty-Five or any block theme.;20 000+ активных установок;6.8.1Ecwid by Lightspeed Ecommerce Shopping Cart;https://ru.wordpress.org/plugins/ecwid-shopping-cart/;Powerful, easy to use ecommerce shopping cart for WordPress. Продажи в соцсетях. iPhone & Android apps. Superb support.;20 000+ активных установок;6.8.1WP Map Block — Блок карт Gutenberg для карт Google и OpenStreet Map by aBlocks;https://ru.wordpress.org/plugins/wp-map-block/;Для запуска Google Maps и OpenStreetMap ключ API не требуется.;20 000+ активных установок;6.8.1SyntaxHighlighter Evolved;https://ru.wordpress.org/plugins/syntaxhighlighter/;Easily post syntax-highlighted code to your site without having to modify the code at all. As seen on WordPress.com.;20 000+ активных установок;6.7.2Embed PDF Viewer;https://ru.wordpress.org/plugins/embed-pdf-viewer/;Embed a PDF from the Media Library or elsewhere via oEmbed or as a block into an iframe tag.;20 000+ активных установок;6.7.2WPZOOM Portfolio Lite — Filterable Portfolio Plugin;https://ru.wordpress.org/plugins/wpzoom-portfolio/;The Ultimate WordPress Portfolio Plugin to Showcase Your Work in Style;20 000+ активных установок;6.8.1Image Photo Gallery Final Tiles Grid;https://ru.wordpress.org/plugins/final-tiles-grid-gallery-lite/;"Галерея изображений + Галерея фотографий + Галерея портфолио + Плиточная галерея в 1 плагине. Включает лайтбокс и эффекты при наведении. Он поддерживает Pinterest (кирпичная кладка) ph & hellip;";20 000+ активных установок;6.8.1Registration, User Profile, Membership, Content Restriction, User Directory, and Frontend Post Submission – WP User Frontend;https://ru.wordpress.org/plugins/wp-user-frontend/;Frontend post, content restriction, user login & registration, subscription & membership, forms, user directory & profile builder for your website.;20 000+ активных установок;6.8.1Slider by 10Web — Responsive Image Slider;https://ru.wordpress.org/plugins/slider-wd/;Slider by 10Web plugin is the perfect slider solution for Wordpress.;20 000+ активных установок;5.8.10Блок карт для Google Maps;https://ru.wordpress.org/plugins/map-block-gutenberg/;Блок карт для редактора Gutenberg работает на Google Maps. Просто. Быстро. Ничего лишнего. Просто блок карт.;20 000+ активных установок;6.8.1Reusable Blocks Extended;https://ru.wordpress.org/plugins/reusable-blocks-extended/;Расширьте функционал многоразовых блоков Gutenberg с помощью полноценной панели администратора, виджетов, шорткодов и функций PHP.;20 000+ активных установок;6.8.110WebSocial;https://ru.wordpress.org/plugins/wd-instagram-feed/;10Web;20 000+ активных установок;5.0.22All-in-One Video Gallery;https://ru.wordpress.org/plugins/all-in-one-video-gallery/;The ultimate video player & video gallery plugin for YouTubers, Video Bloggers, Course Creators, Podcasters, and anyone embedding videos on websites.;20 000+ активных установок;6.8.1UsersWP — Front-end login form, User Registration, User Profile & Members Directory plugin for WP;https://ru.wordpress.org/plugins/userswp/;Light weight Front-end login form, User Registration, User Profile and Members Directory plugin.;20 000+ активных установок;6.8.1Page View Count;https://ru.wordpress.org/plugins/page-views-count/;Places an icon, all time views count and views today count at the bottom of posts, pages and custom post types on any WordPress website.;20 000+ активных установок;6.8.1Appointment Hour Booking — Плагин WordPress бронирования;https://ru.wordpress.org/plugins/appointment-hour-booking/;Appointment Hour Booking — это плагин для создания форм бронирования встреч с указанием времени начала и заданной продолжительности по расписанию.;20 000+ активных установок;6.8.1The Events Calendar Shortcode & Block;https://ru.wordpress.org/plugins/the-events-calendar-shortcode/;Add shortcode, block, Elementor and Bricks functionality to The Events Calendar Plugin, so you can easily list and promote your events anywhere.;20 000+ активных установок;6.8.1Directorist: AI-Powered Business Directory Plugin with Classified Ads Listings;https://ru.wordpress.org/plugins/directorist/;An Excellent WP Directory Plugin to Create Business Directories, Job Listings, Classified Ads, Booking Directories, Local Directories, and Service Dir …;20 000+ активных установок;6.8.1YASR — Yet Another Star Rating Plugin for WordPress;https://ru.wordpress.org/plugins/yet-another-stars-rating/;Boost the way people interact with your site with an easy WordPress stars rating system! With schema.org rich snippets YASR will improve your SEO;10 000+ активных установок;6.8.1WP Meta SEO;https://ru.wordpress.org/plugins/wp-meta-seo/;WP Meta SEO gives you the control over all your SEO optimization. Bulk SEO content and image SEO, on page content check, 404 and redirect;10 000+ активных установок;6.7.2GeoDirectory — WP Business Directory Plugin and Classified Listings Directory;https://ru.wordpress.org/plugins/geodirectory/;A superb WordPress Business Directory plugin to create a local business directory, classified ads directory, or job listings board.;10 000+ активных установок;6.8.1Advanced Sidebar Menu;https://ru.wordpress.org/plugins/advanced-sidebar-menu/;Fully automatic sidebar menus.;10 000+ активных установок;6.8.1WordPress Slider Block Gutenslider;https://ru.wordpress.org/plugins/gutenslider/;Плагин слайдера для Гутенберг. Создайте слайдер изображений, слайдер видео, полноэкранный слайдер с помощью этого мощного блока слайдера и добавьте любой блок сверху.;10 000+ активных установок;6.4.5Events Shortcodes For The Events Calendar;https://ru.wordpress.org/plugins/template-events-calendar/;Easily add The Events Calendar shortcode or Gutenberg event block on any page and show upcoming events list.;10 000+ активных установок;6.8.1Photonic Gallery & Lightbox for Flickr, SmugMug & Others;https://ru.wordpress.org/plugins/photonic/;Galleries on steroids! A stylish lightbox & gallery plugin for WP, Flickr, SmugMug and Zenfolio photos and videos.;10 000+ активных установок;6.8.1Highlighting Code Block;https://ru.wordpress.org/plugins/highlighting-code-block/;Добавьте блок кода с подсветкой синтаксиса с помощью prism.js. (Доступно для Gutenberg и Classic Editor);10 000+ активных установок;6.4.5